{
  "schemaVersion": "v1-mvp-content-quality.sample-manifest.1",
  "generatedAt": "2026-07-03T04:57:21.168Z",
  "acceptanceMode": "v1_mvp_content_quality_strict",
  "categories": [
    {
      "categoryId": "domestic_portal_homepage",
      "displayName": "国内新闻 / 门户首页",
      "minSamples": 6,
      "minPassed": 5
    },
    {
      "categoryId": "domestic_article_detail",
      "displayName": "国内新闻 / 图文详情页",
      "minSamples": 6,
      "minPassed": 5
    },
    {
      "categoryId": "domestic_content_platform",
      "displayName": "国内图文社区 / 内容平台",
      "minSamples": 6,
      "minPassed": 5
    },
    {
      "categoryId": "international_portal_homepage",
      "displayName": "国外新闻 / 门户首页",
      "minSamples": 6,
      "minPassed": 5
    },
    {
      "categoryId": "international_article_detail",
      "displayName": "国外新闻 / 图文详情页",
      "minSamples": 6,
      "minPassed": 5
    },
    {
      "categoryId": "international_knowledge_blog_doc",
      "displayName": "国外百科 / 博客 / 文档型图文页",
      "minSamples": 6,
      "minPassed": 5
    }
  ],
  "samples": [
    {
      "pageId": "international-article-theverge",
      "url": "https://www.theverge.com/tech",
      "site": "The Verge",
      "countryRegion": "international",
      "contentCategory": "international_article_detail",
      "pageType": "channel",
      "sourceStage": "high_risk_new",
      "loginStatePolicy": "public_no_login",
      "goldNotePath": "docs/active/project/evidence/v1_mvp_content_quality/gold-notes/international-article-theverge.json",
      "expectedMainSignals": [
        "tech headline",
        "article cards",
        "summary"
      ],
      "prohibitedNoiseSignals": [
        "首页",
        "登录",
        "广告",
        "推荐",
        "评论",
        "版权",
        "导航",
        "图1"
      ],
      "requiredEvidenceTargets": [
        "article_body",
        "MIA SATO 5 26 AM GMT+8 Kalta?",
        "核心要点"
      ],
      "replacementFor": null,
      "replacementReason": null,
      "validationNotes": "CQ strict 样本，必须证明总结、问答、选区解释、导图节点和 source evidence 均来自主内容或正确降级。"
    }
  ]
}